{
  "noteId": "mn_eval_m09",
  "sourceRefs": [
    {
      "sourceId": "src_eval_m09",
      "sourceType": "MEETING_NOTE"
    }
  ],
  "occurredAt": "2026-10-28T09:30:00",
  "location": "화상회의",
  "mode": "FULL",
  "participants": [
    {
      "displayName": "조가상 매니저",
      "resolutionId": null,
      "personId": null
    }
  ],
  "fields": {
    "discussion": [
      {
        "text": "PoC 결과 공유, 응답 속도 목표치(2초 이내) 달성",
        "evidence": "PoC 결과 공유함. 응답 속도 목표치(2초 이내) 달성"
      }
    ],
    "customerRequests": [
      {
        "text": "본 계약 전 부하 테스트 리포트 요청",
        "evidence": "본 계약 전에 부하 테스트 리포트 요청"
      }
    ],
    "concerns": [
      {
        "text": "동시 접속 500명 초과 시 지연 발생 우려",
        "evidence": "다만 동시 접속 500명 넘을 때 지연 생기는 부분 확인 필요하다고 하심"
      }
    ],
    "commitments": [
      {
        "text": "다음 달 초 부하 테스트 진행 후 결과 리포트 공유",
        "evidence": "부하 테스트는 다음 달 초에 진행하고 결과 리포트 공유하기로"
      }
    ],
    "nextContact": [
      {
        "text": "내부 보고 후 예산 확정되면 고객이 연락",
        "evidence": "매니저님이 내부 보고 후 예산 확정되면 연락 주시기로"
      }
    ]
  },
  "missingFields": [],
  "uncertainSegments": [],
  "status": "DRAFT",
  "generatedBy": "HUMAN",
  "llmModel": null
}
