{
  "noteId": "mn_eval_e03",
  "sourceRefs": [
    {
      "sourceId": "src_eval_e03",
      "sourceType": "EMAIL"
    }
  ],
  "occurredAt": "2026-10-23T11:05:00",
  "location": null,
  "mode": "FULL",
  "participants": [
    {
      "displayName": "홍길동 부장",
      "resolutionId": null,
      "personId": null
    },
    {
      "displayName": "박가상 대리",
      "resolutionId": null,
      "personId": null
    }
  ],
  "fields": {
    "discussion": [
      {
        "text": "보안 점검 결과: 외부 접속 로그 1년 이상 보관 필요",
        "evidence": "지난 미팅 때 말씀드린 보안 점검 결과가 나왔는데, 외부 접속 로그 보관 기간이 1년 이상이어야 한다고 합니다."
      },
      {
        "text": "기술 문의 창구를 박가상 대리로 지정",
        "evidence": "박가상 대리가 기술 문의 창구를 맡기로 했으니 앞으로 기술 관련은 박 대리에게 바로 연락 주시면 됩니다."
      }
    ],
    "customerRequests": [
      {
        "text": "로그 1년 이상 보관 조건 충족 여부 확인 요청",
        "evidence": "이 조건 맞출 수 있는지 확인 부탁드립니다."
      }
    ],
    "concerns": [],
    "commitments": [
      {
        "text": "계약서 초안 법무 검토 후 다음 주 중 송부 (고객 측)",
        "evidence": "계약서 초안은 저희 법무팀 검토 끝나는 대로 다음 주 중에 보내드리겠습니다."
      }
    ],
    "nextContact": []
  },
  "missingFields": [
    "concerns",
    "nextContact"
  ],
  "uncertainSegments": [],
  "status": "DRAFT",
  "generatedBy": "HUMAN",
  "llmModel": null
}
