{
  "noteId": "mn_eval_m04",
  "sourceRefs": [
    {
      "sourceId": "src_eval_m04",
      "sourceType": "MEETING_NOTE"
    }
  ],
  "occurredAt": "2026-10-16T17:20:00",
  "location": null,
  "mode": "FULL",
  "participants": [
    {
      "displayName": "정샘플 팀장",
      "resolutionId": null,
      "personId": null
    }
  ],
  "fields": {
    "discussion": [
      {
        "text": "재고 관리 모듈 업데이트 후 문제 없이 사용 중",
        "evidence": "재고 관리 모듈 업데이트 이후로 큰 문제 없이 잘 쓰고 있다고 함"
      }
    ],
    "customerRequests": [],
    "concerns": [],
    "commitments": [],
    "nextContact": [
      {
        "text": "11월 둘째 주 사용 현황 점검 방문",
        "evidence": "다음 분기 사용 현황 점검 겸 11월 둘째 주에 한번 찾아뵙기로"
      }
    ]
  },
  "missingFields": [
    "customerRequests",
    "concerns",
    "commitments"
  ],
  "uncertainSegments": [],
  "status": "DRAFT",
  "generatedBy": "HUMAN",
  "llmModel": null
}
