{
  "noteId": "mn_eval_m01",
  "sourceRefs": [
    {
      "sourceId": "src_eval_m01",
      "sourceType": "MEETING_NOTE"
    }
  ],
  "occurredAt": "2026-10-14T15:00:00",
  "location": "가상전자 본사 3층 회의실",
  "mode": "FULL",
  "participants": [
    {
      "displayName": "홍길동 부장",
      "resolutionId": null,
      "personId": null
    }
  ],
  "fields": {
    "discussion": [
      {
        "text": "사내 메신저 교체 검토 (기존 라이선스 내년 3월 만료)",
        "evidence": "사내 메신저 교체 건으로 만남. 지금 쓰는 시스템 라이선스가 내년 3월에 끝난다고 함"
      },
      {
        "text": "협업툴 데모에서 화상회의 기능 반응 좋음",
        "evidence": "우리 협업툴 데모 보시고 화상회의 기능 반응 좋았음"
      }
    ],
    "customerRequests": [
      {
        "text": "사용자 300명 기준 견적 요청",
        "evidence": "사용자 300명 기준으로 견적 받아보고 싶다고 하심"
      },
      {
        "text": "기존 메신저 대화 기록 이관 가능 여부 확인 요청",
        "evidence": "기존 메신저 대화 기록 옮길 수 있는지 확인 요청"
      }
    ],
    "concerns": [],
    "commitments": [
      {
        "text": "견적서 이번 주 금요일까지 메일 송부",
        "evidence": "견적서는 이번 주 금요일까지 메일로 보내드리기로 함"
      },
      {
        "text": "데이터 이관 가능 여부 기술팀 확인 후 다음 주 화요일까지 회신",
        "evidence": "데이터 이관 가능 여부는 기술팀 확인 후 다음 주 화요일까지 회신드리기로"
      },
      {
        "text": "내부 결재 라인 정리해서 공유 (고객 측)",
        "evidence": "부장님도 내부 결재 라인 정리해서 알려주신다고 함"
      }
    ],
    "nextContact": [
      {
        "text": "2주 뒤 실무진 포함 2차 미팅",
        "evidence": "2주 뒤에 실무진 같이 모여서 2차 미팅 하기로"
      }
    ]
  },
  "missingFields": [
    "concerns"
  ],
  "uncertainSegments": [],
  "status": "DRAFT",
  "generatedBy": "HUMAN",
  "llmModel": null
}
